{
  "$schema": "./compatibility-ledger.modules.schema.json",
  "version": 1,
  "nuxtImportsDeclaration": ".nuxt/imports.d.ts",
  "behaviorProfiles": "planning/complete/plugin-runtime-v2/compatibility-profiles.json",
  "modules": [
    { "source": "app/composables/index.ts", "runtime": "client", "publicPaths": ["~/composables"], "docs": ["public/_documentation/start/plugin-quickstart.md"] },
    { "source": "app/composables/admin/useAdminPlugins.ts", "runtime": "client", "publicPaths": ["~/composables/admin/useAdminPlugins"], "docs": ["public/_documentation/start/plugin-quickstart.md"], "behaviorProfileIds": ["registry.admin-extensions"] },
    { "source": "app/composables/_registry.ts", "runtime": "client", "publicPaths": ["~/composables/_registry"], "docs": ["public/_documentation/types/overview.md"] },
    { "source": "app/composables/chat/useMessageActions.ts", "runtime": "client", "publicPaths": ["~/composables/chat/useMessageActions"], "docs": ["public/_documentation/start/source-map.md"], "behaviorProfileIds": ["registry.message-actions"] },
    { "source": "app/composables/core/useHookEffect.ts", "runtime": "client", "publicPaths": ["~/composables/core/useHookEffect"], "docs": ["public/_documentation/hooks/reference.md"] },
    { "source": "app/composables/core/usePaneApps.ts", "runtime": "client", "publicPaths": ["~/composables/core/usePaneApps"], "docs": ["docs/pane-plugin-api.md"], "behaviorProfileIds": ["registry.pane-apps"] },
    { "source": "app/composables/dashboard/useDashboardPlugins.ts", "runtime": "client", "publicPaths": ["~/composables/dashboard/useDashboardPlugins"], "docs": ["public/_documentation/start/source-map.md", "docs/UI/dashboard-plugins.md"], "behaviorProfileIds": ["registry.dashboard"] },
    { "source": "app/composables/documents/useDocumentHistoryActions.ts", "runtime": "client", "publicPaths": ["~/composables/documents/useDocumentHistoryActions"], "docs": ["public/_documentation/start/source-map.md"], "behaviorProfileIds": ["registry.history-actions"] },
    { "source": "app/composables/editor/useDocumentAiActions.ts", "runtime": "client", "publicPaths": ["~/composables/editor/useDocumentAiActions"], "docs": ["docs/UI/editor-extensions.md"], "behaviorProfileIds": ["registry.document-ai-actions"] },
    { "source": "app/composables/editor/useEditorExtensionLoader.ts", "runtime": "client", "publicPaths": ["~/composables/editor/useEditorExtensionLoader"], "docs": ["public/_documentation/start/source-map.md"], "behaviorProfileIds": ["registry.editor-extensions"] },
    { "source": "app/composables/editor/useEditorInspectorPanels.ts", "runtime": "client", "publicPaths": ["~/composables/editor/useEditorInspectorPanels"], "docs": ["docs/UI/editor-extensions.md"], "behaviorProfileIds": ["registry.editor-inspector-panels"] },
    { "source": "app/composables/editor/useEditorNodes.ts", "runtime": "client", "publicPaths": ["~/composables/editor/useEditorNodes"], "docs": ["public/_documentation/start/source-map.md"], "behaviorProfileIds": ["registry.editor-extensions"] },
    { "source": "app/composables/editor/useEditorToolbar.ts", "runtime": "client", "publicPaths": ["~/composables/editor/useEditorToolbar"], "docs": ["public/_documentation/start/source-map.md"], "behaviorProfileIds": ["registry.editor-toolbar"] },
    { "source": "app/composables/history/createHistoryActionRegistry.ts", "runtime": "client", "publicPaths": ["~/composables/history/createHistoryActionRegistry"], "docs": ["public/_documentation/start/source-map.md"], "behaviorProfileIds": ["registry.history-actions"] },
    { "source": "app/composables/plugins/workspace-runtime.ts", "runtime": "client", "publicPaths": ["~/composables/plugins/workspace-runtime"], "docs": ["public/_documentation/start/plugin-quickstart.md"] },
    { "source": "app/composables/plugins/trusted-host-context.ts", "runtime": "client", "publicPaths": ["~/composables/plugins/trusted-host-context"], "docs": ["public/_documentation/start/plugin-quickstart.md"] },
    { "source": "app/composables/projects/useProjectTreeActions.ts", "runtime": "client", "publicPaths": ["~/composables/projects/useProjectTreeActions"], "docs": ["public/_documentation/start/source-map.md"], "behaviorProfileIds": ["registry.project-tree-actions"] },
    { "source": "app/composables/sidebar/registerSidebarPage.ts", "runtime": "client", "publicPaths": ["~/composables/sidebar/registerSidebarPage", "~/composables/sidebar"], "docs": ["public/_documentation/start/source-map.md"], "behaviorProfileIds": ["registry.sidebar-pages"] },
    { "source": "app/composables/sidebar/useComposerActions.ts", "runtime": "client", "publicPaths": ["~/composables/sidebar/useComposerActions"], "docs": ["public/_documentation/start/source-map.md"], "behaviorProfileIds": ["registry.composer-actions"] },
    { "source": "app/composables/sidebar/useHeaderActions.ts", "runtime": "client", "publicPaths": ["~/composables/sidebar/useHeaderActions"], "docs": ["public/_documentation/start/source-map.md"], "behaviorProfileIds": ["registry.header-actions"] },
    { "source": "app/composables/sidebar/useSidebarEnvironment.ts", "runtime": "client", "publicPaths": ["~/composables/sidebar/useSidebarEnvironment", "~/composables/sidebar"], "docs": ["public/_documentation/start/source-map.md"] },
    { "source": "app/composables/sidebar/useSidebarPageControls.ts", "runtime": "client", "publicPaths": ["~/composables/sidebar/useSidebarPageControls", "~/composables/sidebar"], "docs": ["public/_documentation/start/source-map.md"] },
    { "source": "app/composables/sidebar/useSidebarPages.ts", "runtime": "client", "publicPaths": ["~/composables/sidebar/useSidebarPages", "~/composables/sidebar"], "docs": ["public/_documentation/start/source-map.md"], "behaviorProfileIds": ["registry.sidebar-pages"] },
    { "source": "app/composables/sidebar/useSidebarSections.ts", "runtime": "client", "publicPaths": ["~/composables/sidebar/useSidebarSections"], "docs": ["public/_documentation/start/source-map.md"], "behaviorProfileIds": ["registry.sidebar-footer-actions", "registry.sidebar-sections"] },
    { "source": "app/composables/threads/useThreadHistoryActions.ts", "runtime": "client", "publicPaths": ["~/composables/threads/useThreadHistoryActions"], "docs": ["public/_documentation/start/source-map.md"], "behaviorProfileIds": ["registry.history-actions"] },
    { "source": "app/core/hooks/hook-keys.ts", "runtime": "client", "publicPaths": ["~/core/hooks/hook-keys"], "docs": ["public/_documentation/hooks/hook-catalog.md"] },
    { "source": "app/core/hooks/hook-types.ts", "runtime": "client", "publicPaths": ["~/core/hooks/hook-types"], "docs": ["public/_documentation/hooks/reference.md"] },
    { "source": "app/core/hooks/hooks.ts", "runtime": "client", "publicPaths": ["~/core/hooks/hooks", "~/core/hooks"], "docs": ["public/_documentation/hooks/reference.md", "docs/hooks.md"] },
    { "source": "app/core/hooks/typed-hooks.ts", "runtime": "client", "publicPaths": ["~/core/hooks/typed-hooks"], "docs": ["public/_documentation/hooks/reference.md", "docs/hooks-augmentation.md"] },
    { "source": "app/core/hooks/useHooks.ts", "runtime": "client", "publicPaths": ["~/core/hooks/useHooks"], "docs": ["docs/hooks.md"] },
    { "source": "app/utils/chat/tool-registry.ts", "runtime": "client", "publicPaths": ["~/utils/chat/tool-registry"], "docs": ["public/_documentation/start/plugin-quickstart.md"], "behaviorProfileIds": ["registry.client-tools"] },
    { "source": "app/utils/chat/tools-public.ts", "runtime": "client", "publicPaths": ["~/utils/chat/tools-public"], "docs": ["public/_documentation/start/plugin-quickstart.md"] },
    { "source": "server/hooks/admin-hook-types.ts", "runtime": "server", "publicPaths": ["~~/server/hooks/admin-hook-types"], "docs": ["docs/hooks.md"] },
    { "source": "server/hooks/hook-engine.ts", "runtime": "server", "publicPaths": ["~~/server/hooks/hook-engine"], "docs": ["docs/hooks.md"] },
    { "source": "server/hooks/index.ts", "runtime": "server", "publicPaths": ["~~/server/hooks"], "docs": ["docs/hooks.md"] },
    { "source": "server/hooks/typed-hooks.ts", "runtime": "server", "publicPaths": ["~~/server/hooks/typed-hooks"], "docs": ["docs/hooks.md"] },
    { "source": "server/utils/chat/tool-registry.ts", "runtime": "server", "publicPaths": ["~~/server/utils/chat/tool-registry"], "docs": ["public/_documentation/start/plugin-quickstart.md"], "behaviorProfileIds": ["registry.server-tools"] },
    { "source": "shared/hooks/hook-engine-core.ts", "runtime": "shared", "publicPaths": ["~~/shared/hooks/hook-engine-core"], "docs": ["docs/hooks.md"] },
    { "source": "shared/plugins/registration-handle.ts", "runtime": "shared", "publicPaths": ["~~/shared/plugins/registration-handle"], "docs": ["public/_documentation/types/overview.md"] }
  ]
}
